{"Git": [1, "/categories/git.html", {"posts": [{"date": "11/15/2012", "url": "/posts/git-proxy-config.html", "isodate": "2012-11-15T12:00:00+01:00", "title": "Configuraci\u00f3n de proxy para Git"}]}], "Java": [2, "/categories/java.html", {"posts": [{"date": "06/07/2014", "url": "/posts/java-embedded-db-performance-comparison.html", "isodate": "2014-06-07T18:09:00+02:00", "title": "Bases de Datos Embebidas Java: Performance comparison"}, {"date": "05/13/2014", "url": "/posts/serialization-java-serializable-externalizable.html", "isodate": "2014-05-13T17:00:00+02:00", "title": "Distintas formas de serializaci\u00f3n en Java: Comparaci\u00f3n de rendimiento"}, {"date": "10/20/2013", "url": "/posts/android-studio-portable-download.html", "isodate": "2013-10-20T13:00:00+02:00", "title": "Android Studio Portable Download"}]}], "GNU": [1, "/categories/gnu.html", {"posts": [{"date": "02/01/2013", "url": "/posts/debug-libtool-lib.html", "isodate": "2013-02-01T15:30:00+01:00", "title": "Depurar librer\u00eda generada con libtool"}]}], "Archlinux": [1, "/categories/archlinux.html", {"posts": [{"date": "10/02/2012", "url": "/posts/linux-remove-orphaned-files.html", "isodate": "2012-10-02T13:30:02+02:00", "title": "Eliminar paquetes hu\u00e9rfanos en Linux"}]}], "pthread": [1, "/categories/pthread.html", {"posts": [{"date": "04/24/2014", "url": "/posts/cpp-mutex.html", "isodate": "2014-04-24T17:50:00+02:00", "title": "Mutex C++"}]}], "Android": [1, "/categories/android.html", {"posts": [{"date": "10/20/2013", "url": "/posts/android-studio-portable-download.html", "isodate": "2013-10-20T13:00:00+02:00", "title": "Android Studio Portable Download"}]}], "Math": [1, "/categories/math.html", {"posts": [{"date": "04/03/2014", "url": "/posts/equations-that-changed-the-word.html", "isodate": "2014-04-03T11:30:00+02:00", "title": "Ecuaciones que han cambiado el Mundo"}]}], "Python": [5, "/categories/python.html", {"posts": [{"date": "04/20/2014", "url": "/posts/async-what-how-when.html", "isodate": "2014-04-20T13:35:00+02:00", "title": "Python asyncio: Qu\u00e9, C\u00f3mo, C\u00faando"}, {"date": "03/27/2014", "url": "/posts/primer-post.html", "isodate": "2014-03-27T13:30:02+01:00", "title": "Primer Post utilizando Nikola"}, {"date": "10/23/2012", "url": "/posts/remove-replace-punctuation-py.html", "isodate": "2012-10-23T15:00:00+02:00", "title": "Eliminar/Reemplazar signos de puntuaci\u00f3n en Python"}, {"date": "10/02/2012", "url": "/posts/normalize-text-py.html", "isodate": "2012-10-02T18:00:00+02:00", "title": "Normalizar texto en Python"}, {"date": "10/02/2012", "url": "/posts/delete-html-tags-py-django.html", "isodate": "2012-10-02T11:30:00+02:00", "title": "Eliminar etiquetas HTML"}]}], "HTML": [1, "/categories/html.html", {"posts": [{"date": "10/02/2012", "url": "/posts/delete-html-tags-py-django.html", "isodate": "2012-10-02T11:30:00+02:00", "title": "Eliminar etiquetas HTML"}]}], "Proxy": [1, "/categories/proxy.html", {"posts": [{"date": "11/15/2012", "url": "/posts/git-proxy-config.html", "isodate": "2012-11-15T12:00:00+01:00", "title": "Configuraci\u00f3n de proxy para Git"}]}], "Tips and Tricks": [6, "/categories/tips-and-tricks.html", {"posts": [{"date": "02/01/2013", "url": "/posts/debug-libtool-lib.html", "isodate": "2013-02-01T15:30:00+01:00", "title": "Depurar librer\u00eda generada con libtool"}, {"date": "11/15/2012", "url": "/posts/git-proxy-config.html", "isodate": "2012-11-15T12:00:00+01:00", "title": "Configuraci\u00f3n de proxy para Git"}, {"date": "10/23/2012", "url": "/posts/remove-replace-punctuation-py.html", "isodate": "2012-10-23T15:00:00+02:00", "title": "Eliminar/Reemplazar signos de puntuaci\u00f3n en Python"}, {"date": "10/02/2012", "url": "/posts/normalize-text-py.html", "isodate": "2012-10-02T18:00:00+02:00", "title": "Normalizar texto en Python"}, {"date": "10/02/2012", "url": "/posts/cheat-sheets-for-developers.html", "isodate": "2012-10-02T15:30:00+02:00", "title": "Chuletas para desarrolladores"}, {"date": "10/02/2012", "url": "/posts/linux-remove-orphaned-files.html", "isodate": "2012-10-02T13:30:02+02:00", "title": "Eliminar paquetes hu\u00e9rfanos en Linux"}]}], "G+": [1, "/categories/g.html", {"posts": [{"date": "04/03/2014", "url": "/posts/equations-that-changed-the-word.html", "isodate": "2014-04-03T11:30:00+02:00", "title": "Ecuaciones que han cambiado el Mundo"}]}], "Debian": [1, "/categories/debian.html", {"posts": [{"date": "10/02/2012", "url": "/posts/linux-remove-orphaned-files.html", "isodate": "2012-10-02T13:30:02+02:00", "title": "Eliminar paquetes hu\u00e9rfanos en Linux"}]}], "Pysics": [1, "/categories/pysics.html", {"posts": [{"date": "04/03/2014", "url": "/posts/equations-that-changed-the-word.html", "isodate": "2014-04-03T11:30:00+02:00", "title": "Ecuaciones que han cambiado el Mundo"}]}], "Science": [1, "/categories/science.html", {"posts": [{"date": "04/03/2014", "url": "/posts/equations-that-changed-the-word.html", "isodate": "2014-04-03T11:30:00+02:00", "title": "Ecuaciones que han cambiado el Mundo"}]}], "Programming": [1, "/categories/programming.html", {"posts": [{"date": "04/20/2014", "url": "/posts/async-what-how-when.html", "isodate": "2014-04-20T13:35:00+02:00", "title": "Python asyncio: Qu\u00e9, C\u00f3mo, C\u00faando"}]}], "C++": [3, "/categories/c.html", {"posts": [{"date": "04/24/2014", "url": "/posts/cpp-mutex.html", "isodate": "2014-04-24T17:50:00+02:00", "title": "Mutex C++"}, {"date": "02/01/2013", "url": "/posts/debug-libtool-lib.html", "isodate": "2013-02-01T15:30:00+01:00", "title": "Depurar librer\u00eda generada con libtool"}, {"date": "11/26/2012", "url": "/posts/cpp-pragma-pack.html", "isodate": "2012-11-26T12:00:00+01:00", "title": "Mapeo de un struct C++ en Memoria"}]}], "Django": [1, "/categories/django.html", {"posts": [{"date": "10/02/2012", "url": "/posts/delete-html-tags-py-django.html", "isodate": "2012-10-02T11:30:00+02:00", "title": "Eliminar etiquetas HTML"}]}], "Cheat Sheet": [1, "/categories/cheat-sheet.html", {"posts": [{"date": "10/02/2012", "url": "/posts/cheat-sheets-for-developers.html", "isodate": "2012-10-02T15:30:00+02:00", "title": "Chuletas para desarrolladores"}]}], "Autotools": [1, "/categories/autotools.html", {"posts": [{"date": "02/01/2013", "url": "/posts/debug-libtool-lib.html", "isodate": "2013-02-01T15:30:00+01:00", "title": "Depurar librer\u00eda generada con libtool"}]}], "Linux": [1, "/categories/linux.html", {"posts": [{"date": "10/02/2012", "url": "/posts/linux-remove-orphaned-files.html", "isodate": "2012-10-02T13:30:02+02:00", "title": "Eliminar paquetes hu\u00e9rfanos en Linux"}]}], "Static Sites": [1, "/categories/static-sites.html", {"posts": [{"date": "03/27/2014", "url": "/posts/primer-post.html", "isodate": "2014-03-27T13:30:02+01:00", "title": "Primer Post utilizando Nikola"}]}]}